{
  "id": "parcel-area-budget",
  "imports": [
    {
      "claim_id": "pluto.0.lotarea",
      "type": "recorded_lot_sf"
    }
  ],
  "name": "Illustrative area budget, not a proposed or approved building",
  "parameters": [
    {
      "id": "scenario.gross_area_sf",
      "label": "gross_area_sf",
      "rationale": "Practitioner brief test assumption; not measured capacity or surveyed design.",
      "type": "gross_sf",
      "value": 15000
    },
    {
      "id": "scenario.nonresidential_gross_sf",
      "label": "nonresidential_gross_sf",
      "rationale": "Practitioner brief test assumption; not measured capacity or surveyed design.",
      "type": "gross_sf",
      "value": 1500
    },
    {
      "id": "scenario.residential_net_efficiency",
      "label": "residential_net_efficiency",
      "rationale": "Practitioner brief test assumption; not measured capacity or surveyed design.",
      "type": "share",
      "value": 0.8
    },
    {
      "id": "scenario.average_net_home_sf",
      "label": "average_net_home_sf",
      "rationale": "Practitioner brief test assumption; not measured capacity or surveyed design.",
      "type": "net_sf_per_home",
      "value": 800
    }
  ],
  "purpose": "Explicit area-budget arithmetic for a practitioner-led lot investigation; not design or entitlement.",
  "review_gates": [
    "unknown.current_use",
    "unknown.title",
    "unknown.entitlement",
    "unknown.physical_fit",
    "unknown.environment",
    "unknown.finance",
    "unknown.transit",
    "unknown.process_coverage"
  ],
  "revision": "1",
  "steps": [
    {
      "id": "scenario.residential_gross_sf",
      "inputs": [
        "scenario.gross_area_sf",
        "scenario.nonresidential_gross_sf"
      ],
      "label": "Residential gross area allocation",
      "method": "area.subtract@1",
      "on_missing": "block",
      "rationale": "User-stated area budget; not a verified design or entitlement.",
      "type": "gross_sf"
    },
    {
      "id": "scenario.residential_net_sf",
      "inputs": [
        "scenario.residential_gross_sf",
        "scenario.residential_net_efficiency"
      ],
      "label": "Residential net area allowance",
      "method": "area.apply_efficiency@1",
      "on_missing": "block",
      "rationale": "User-stated area budget; not a verified design or entitlement.",
      "type": "net_sf"
    },
    {
      "id": "scenario.home_equivalents",
      "inputs": [
        "scenario.residential_net_sf",
        "scenario.average_net_home_sf"
      ],
      "label": "Area-budget home-equivalents",
      "method": "homes.net_quotient@1",
      "on_missing": "block",
      "rationale": "User-stated area budget; not a verified design or entitlement.",
      "type": "home_equivalents"
    },
    {
      "id": "scenario.gross_to_recorded_lot_ratio",
      "inputs": [
        "scenario.gross_area_sf",
        "pluto.0.lotarea"
      ],
      "label": "Proposed gross area / recorded lot area",
      "method": "area.recorded_lot_ratio@1",
      "on_missing": "skip",
      "rationale": "User-stated area budget; not a verified design or entitlement.",
      "type": "ratio"
    }
  ],
  "version": "0.1.0"
}
